[{"id":"rebirth-starter","type":"collection","kind":"set","title":"Rebirth: read and practise","intro":"The essays and practices gathered on the Rebirth hub, grouped by tradition. Talks are ranked live by the hub.","author":"wiser","visibility":"public","topics":["rebirth"],"ordered":false,"units":[{"n":1,"title":"Read and practise","track":"both","items":[{"ref":{"id":"practice/the-five-remembrances"},"role":"practise","group":"Theravāda"},{"ref":{"id":"practice/mindfulness-of-death-maranasati"},"role":"practise","group":"Theravāda"},{"ref":{"id":"practice/recollecting-the-round"},"role":"practise","group":"Early suttas"},{"ref":{"id":"practice/powa-an-introduction-to-transference-at-death"},"role":"practise","group":"Tibetan"},{"ref":{"id":"practice/preparing-for-the-bardo"},"role":"practise","group":"Tibetan"},{"ref":{"id":"practice/self-enquiry-who-dies"},"role":"practise","group":"Advaita Vedānta"},{"ref":{"id":"practice/practising-dying-melete-thanatou"},"role":"practise","group":"Platonic"},{"ref":{"id":"text/the-truth-of-rebirth-and-why-it-matters-for-buddhist-practic"},"role":"read","group":"Theravāda","note":"A full book, free from the author's monastery: why the Buddha taught rebirth and how it shapes practice."},{"ref":{"id":"text/does-rebirth-make-sense"},"role":"read","group":"Theravāda","note":"A short essay on rebirth without a soul, and why it matters to the path."},{"ref":{"id":"text/karma"},"role":"read","group":"Theravāda","note":"Karma as intention, and how the Buddha's version differed from his contemporaries'."},{"ref":{"id":"text/mn-4-fear-terror-bhaya-bherava-sutta"},"role":"read","group":"Early suttas","note":"The night of awakening: recollection of past lives, the passing away and rebirth of beings, the ending of the effluents."},{"ref":{"id":"text/sn-15-3-tears-assu-sutta"},"role":"read","group":"Early suttas","note":"The tears shed in the long round outweigh the oceans."},{"ref":{"id":"text/mn-38-the-greater-craving-destruction-discourse"},"role":"read","group":"Early suttas","note":"Sāti thinks the same consciousness wanders on; the Buddha corrects him. The key text on what is (not) reborn."},{"ref":{"id":"text/mn-135-the-shorter-analysis-of-action"},"role":"read","group":"Early suttas","note":"Why some are born short-lived and others long-lived: action and its results across lives."},{"ref":{"id":"text/dn-23-with-payasi"},"role":"read","group":"Early suttas","note":"A sceptical prince tests the afterlife with experiments; a monk answers with parables."},{"ref":{"id":"text/reincarnation"},"role":"read","group":"Advaita Vedānta","note":"The Vedantic case for reincarnation, written for a Western audience in the 1890s."},{"ref":{"id":"text/immortality"},"role":"read","group":"Advaita Vedānta","note":"What in us could survive death, and why the Self was never born."},{"ref":{"id":"text/the-upanishads-incl-katha-naciketas-and-death"},"role":"read","group":"Vedānta","note":"A boy goes to Death's house and asks what happens after we die. Public domain."},{"ref":{"id":"text/the-bhagavad-gita-the-song-celestial"},"role":"read","group":"Hindu","note":"Chapter 2: the Self casts off bodies as we cast off worn clothes. Public domain."},{"ref":{"id":"text/the-republic-book-x-the-myth-of-er"},"role":"read","group":"Platonic","note":"A soldier returns from death and describes souls choosing their next lives."},{"ref":{"id":"text/phaedo"},"role":"read","group":"Platonic","note":"Socrates' last day: arguments for the soul's survival and return. Public domain."},{"ref":{"id":"text/re-embodiment-of-the-spirit-and-destiny-theosophy-ch-2"},"role":"read","group":"Anthroposophy","note":"Steiner's account of reincarnation and karma as laws of spiritual life."},{"ref":{"id":"text/sha-ar-hagilgulim-the-gate-of-reincarnations"},"role":"read","group":"Kabbalah","note":"The Lurianic teaching of gilgul, the soul's transmigration."},{"ref":{"id":"text/the-tibetan-book-of-the-dead"},"role":"read","group":"Tibetan","note":"The Bardo Thödol: instructions read to the dying and the dead."},{"ref":{"id":"text/children-who-report-memories-of-previous-lives"},"role":"read","group":"Research","note":"Ian Stevenson's and Jim Tucker's research programme, in their own words."},{"ref":{"id":"text/near-death-experiences"},"role":"read","group":"Research","note":"What NDE research has found, from the group that has studied it longest."}]}],"license":"CC-BY-4.0","meta":{"license":"CC-BY-4.0","status":"live"}},{"id":"death-starter","type":"collection","kind":"set","title":"Death: read and practise","intro":"The essays and practices gathered on the Death hub, grouped by tradition. Talks are ranked live by the hub.","author":"wiser","visibility":"public","topics":["death"],"ordered":false,"units":[{"n":1,"title":"Read and practise","track":"both","items":[{"ref":{"id":"practice/mindfulness-of-death-maranasati"},"role":"practise","group":"Theravāda"},{"ref":{"id":"practice/the-five-remembrances"},"role":"practise","group":"Theravāda"},{"ref":{"id":"practice/self-enquiry-who-dies"},"role":"practise","group":"Advaita Vedānta"},{"ref":{"id":"practice/powa-an-introduction"},"role":"practise","group":"Tibetan"},{"ref":{"id":"practice/analytic-meditation-on-the-stages-of-the-path"},"role":"practise","group":"Gelug"},{"ref":{"id":"text/salla-sutta-the-arrow"},"role":"read","group":"Early suttas","note":"Life is short and lamenting does not help: pull out the arrow of grief."},{"ref":{"id":"text/mn-130-the-deva-messengers"},"role":"read","group":"Early suttas","note":"Old age, illness and death as messengers we ignore."},{"ref":{"id":"text/phaedo"},"role":"read","group":"Platonic","note":"Socrates' last conversation, on death and the soul."},{"ref":{"id":"text/apology"},"role":"read","group":"Platonic","note":"No one knows whether death is not the greatest of goods."},{"ref":{"id":"text/immortality"},"role":"read","group":"Advaita Vedānta","note":"The Vedantic view of what dies and what does not."},{"ref":{"id":"text/the-tibetan-book-of-the-dead"},"role":"read","group":"Tibetan","note":"The Bardo Thödol."},{"ref":{"id":"text/near-death-experiences"},"role":"read","group":"Research","note":"The research, in the researchers' words."}]}],"license":"CC-BY-4.0","meta":{"license":"CC-BY-4.0","status":"live"}},{"id":"self-starter","type":"collection","kind":"set","title":"Self & not-self: read and practise","intro":"The essays and practices gathered on the Self & not-self hub, grouped by tradition. Talks are ranked live by the hub.","author":"wiser","visibility":"public","topics":["self"],"ordered":false,"units":[{"n":1,"title":"Read and practise","track":"both","items":[{"ref":{"id":"practice/self-enquiry"},"role":"practise","group":"Advaita Vedānta"},{"ref":{"id":"practice/contemplating-not-self"},"role":"practise","group":"Theravāda"},{"ref":{"id":"practice/shiva-process-self-inquiry"},"role":"practise","group":"Kashmir Shaivism"},{"ref":{"id":"practice/what-am-i-don-t-know"},"role":"practise","group":"Seon (Korean Zen)"},{"ref":{"id":"text/no-self-or-not-self"},"role":"read","group":"Theravāda","note":"Why the Buddha set the question of a self aside."},{"ref":{"id":"text/sn-22-59-the-discourse-on-not-self"},"role":"read","group":"Early suttas","note":"The second discourse: form, feeling, perception, fabrications, consciousness are not self."},{"ref":{"id":"text/who-am-i-nan-yar"},"role":"read","group":"Advaita Vedānta","note":"The whole method in a few pages."},{"ref":{"id":"text/the-real-and-the-apparent-man"},"role":"read","group":"Advaita Vedānta","note":"The Self behind the person."},{"ref":{"id":"text/the-upanishads"},"role":"read","group":"Vedānta","note":"Public domain."},{"ref":{"id":"text/dialogues-on-the-supersensual-life"},"role":"read","group":"Christian theosophy (Böhme)"}]}],"license":"CC-BY-4.0","meta":{"license":"CC-BY-4.0","status":"live"}},{"id":"kamma-starter","type":"collection","kind":"set","title":"Karma: read and practise","intro":"The essays and practices gathered on the Karma hub, grouped by tradition. Talks are ranked live by the hub.","author":"wiser","visibility":"public","topics":["kamma"],"ordered":false,"units":[{"n":1,"title":"Read and practise","track":"both","items":[{"ref":{"id":"practice/owner-of-my-actions"},"role":"practise","group":"Theravāda"},{"ref":{"id":"text/karma"},"role":"read","group":"Theravāda","note":"Karma as intention."},{"ref":{"id":"text/mn-135-the-shorter-analysis-of-action"},"role":"read","group":"Early suttas","note":"Action and its results."},{"ref":{"id":"text/the-bhagavad-gita-the-song-celestial"},"role":"read","group":"Hindu","note":"Chapter 3: the yoga of action."},{"ref":{"id":"text/re-embodiment-of-the-spirit-and-destiny"},"role":"read","group":"Anthroposophy","note":"Karma as destiny."}]}],"license":"CC-BY-4.0","meta":{"license":"CC-BY-4.0","status":"live"}},{"id":"meditation-starter","type":"collection","kind":"set","title":"Meditation: read and practise","intro":"The essays and practices gathered on the Meditation hub, grouped by tradition. Talks are ranked live by the hub.","author":"wiser","visibility":"public","topics":["meditation"],"ordered":false,"units":[{"n":1,"title":"Read and practise","track":"both","items":[{"ref":{"id":"practice/mindfulness-of-breathing"},"role":"practise","group":"Theravāda"},{"ref":{"id":"practice/goodwill-metta"},"role":"practise","group":"Theravāda"},{"ref":{"id":"practice/resting-in-the-gap-between-breaths-vijnana-bhairava-dharana"},"role":"practise","group":"Kashmir Shaivism"},{"ref":{"id":"practice/recognition-pratyabhijna-contemplation"},"role":"practise","group":"Pratyabhijñā (Recognition)"},{"ref":{"id":"practice/drawing-the-sri-chakra-as-meditation"},"role":"practise","group":"Śrī Vidyā"},{"ref":{"id":"practice/basic-saiva-siddhanta-meditation"},"role":"practise","group":"Śaiva Siddhānta"},{"ref":{"id":"practice/mantra-repetition-japa"},"role":"practise","group":"Śākta practice (Kālī, Kāmākhyā, Bhairavī)"},{"ref":{"id":"practice/anapan